{"schema_version":2,"fixture_class":"synthetic_live_contract_test_only","hardware_verified":false,"verification":{"status":"synthetic_test_only","evidence":[{"kind":"synthetic_test","source":"https://example.org/v2-test-fixture","recorded_at_ms":1000000}]},"sources":["https://example.org/v2-test-fixture"],"bindings":[{"id":"synthetic.physical_counter","integration":"integration.synthetic","role":"wash_completion","key":"physical_counter","state":"source_documented_capability_dependent","scope":{"model_id":"synthetic_model","sku":"synthetic_sku","firmware":"synthetic_fw","integration_id":"integration.synthetic","integration_version":"synthetic_v2","domain":"sensor","key":"physical_counter","unit":"ml"},"source":"https://example.org/v2-test-fixture"}],"settings":[{"name":"task_scope","state":"unknown","scope":{"model_id":"synthetic_model","sku":"synthetic_sku","firmware":"synthetic_fw","integration_id":"integration.synthetic","integration_version":"synthetic_v2","domain":"test","key":"task_scope","unit":null}},{"name":"suction_level","state":"unknown","scope":{"model_id":"synthetic_model","sku":"synthetic_sku","firmware":"synthetic_fw","integration_id":"integration.synthetic","integration_version":"synthetic_v2","domain":"test","key":"suction_level","unit":null}},{"name":"carpet_policy","state":"unknown","scope":{"model_id":"synthetic_model","sku":"synthetic_sku","firmware":"synthetic_fw","integration_id":"integration.synthetic","integration_version":"synthetic_v2","domain":"test","key":"carpet_policy","unit":null}},{"name":"cleaning_mode","state":"unknown","scope":{"model_id":"synthetic_model","sku":"synthetic_sku","firmware":"synthetic_fw","integration_id":"integration.synthetic","integration_version":"synthetic_v2","domain":"test","key":"cleaning_mode","unit":null}},{"name":"mop_mode","state":"unknown","scope":{"model_id":"synthetic_model","sku":"synthetic_sku","firmware":"synthetic_fw","integration_id":"integration.synthetic","integration_version":"synthetic_v2","domain":"test","key":"mop_mode","unit":null}},{"name":"water_level","state":"unknown","scope":{"model_id":"synthetic_model","sku":"synthetic_sku","firmware":"synthetic_fw","integration_id":"integration.synthetic","integration_version":"synthetic_v2","domain":"test","key":"water_level","unit":null}},{"name":"route","state":"unknown","scope":{"model_id":"synthetic_model","sku":"synthetic_sku","firmware":"synthetic_fw","integration_id":"integration.synthetic","integration_version":"synthetic_v2","domain":"test","key":"route","unit":null}},{"name":"passes","state":"unknown","scope":{"model_id":"synthetic_model","sku":"synthetic_sku","firmware":"synthetic_fw","integration_id":"integration.synthetic","integration_version":"synthetic_v2","domain":"test","key":"passes","unit":null}},{"name":"wash_mode","state":"unknown","scope":{"model_id":"synthetic_model","sku":"synthetic_sku","firmware":"synthetic_fw","integration_id":"integration.synthetic","integration_version":"synthetic_v2","domain":"test","key":"wash_mode","unit":null}},{"name":"wash_frequency","state":"unknown","scope":{"model_id":"synthetic_model","sku":"synthetic_sku","firmware":"synthetic_fw","integration_id":"integration.synthetic","integration_version":"synthetic_v2","domain":"test","key":"wash_frequency","unit":null}},{"name":"wash_temperature","state":"unknown","scope":{"model_id":"synthetic_model","sku":"synthetic_sku","firmware":"synthetic_fw","integration_id":"integration.synthetic","integration_version":"synthetic_v2","domain":"test","key":"wash_temperature","unit":null}},{"name":"adaptive_mode","state":"unknown","scope":{"model_id":"synthetic_model","sku":"synthetic_sku","firmware":"synthetic_fw","integration_id":"integration.synthetic","integration_version":"synthetic_v2","domain":"test","key":"adaptive_mode","unit":null}},{"name":"detergent_mode","state":"unknown","scope":{"model_id":"synthetic_model","sku":"synthetic_sku","firmware":"synthetic_fw","integration_id":"integration.synthetic","integration_version":"synthetic_v2","domain":"test","key":"detergent_mode","unit":null}}],"action_completion":{"wash_mop":{"disposition":"complete","evidence":"counter_increment","reason":"Synthetic-only test counter.","scope":{"model_id":"synthetic_model","sku":"synthetic_sku","firmware":"synthetic_fw","integration_id":"integration.synthetic","integration_version":"synthetic_v2","domain":"sensor","key":"physical_counter","unit":"ml"},"source":"https://example.org/v2-test-fixture"},"tray_clean":{"disposition":"unknown","evidence":"none","reason":"Synthetic test unknown.","scope":{"model_id":"synthetic_model","sku":"synthetic_sku","firmware":"synthetic_fw","integration_id":"integration.synthetic","integration_version":"synthetic_v2","domain":"test","key":"tray_clean","unit":null},"source":"https://example.org/v2-test-fixture"},"flush":{"disposition":"unknown","evidence":"none","reason":"Synthetic test unknown.","scope":{"model_id":"synthetic_model","sku":"synthetic_sku","firmware":"synthetic_fw","integration_id":"integration.synthetic","integration_version":"synthetic_v2","domain":"test","key":"flush","unit":null},"source":"https://example.org/v2-test-fixture"},"refill":{"disposition":"unknown","evidence":"none","reason":"Synthetic test unknown.","scope":{"model_id":"synthetic_model","sku":"synthetic_sku","firmware":"synthetic_fw","integration_id":"integration.synthetic","integration_version":"synthetic_v2","domain":"test","key":"refill","unit":null},"source":"https://example.org/v2-test-fixture"},"detergent_dose":{"disposition":"not_applicable","evidence":"none","reason":"Synthetic test has no detergent conversion.","scope":{"model_id":"synthetic_model","sku":"synthetic_sku","firmware":"synthetic_fw","integration_id":"integration.synthetic","integration_version":"synthetic_v2","domain":"test","key":"detergent","unit":null},"source":"https://example.org/v2-test-fixture"}}}
